"Story","Title","Result","Date","Stability","Duration (s)"
"Second serenity test","File does not exist","COMPROMISED","2019-06-03T23:17:49.757-07:00","0.0","0.23"
"Second serenity test","Get all students","SUCCESS","2019-06-03T23:17:49.990-07:00","0.0","0.18"
"Second serenity test","This is a manual test","PENDING","2019-06-03T23:17:49.152-07:00","0.0","0.26"
"Second serenity test","This is a pending test","PENDING","2019-06-03T23:17:48.894-07:00","0.0","0.23"
"Second serenity test","This is a skipped test","IGNORED","2019-06-03T23:17:41.658-07:00","0.0","0.69"
"Second serenity test","This is atest with error","ERROR","2019-06-03T23:17:42.708-07:00","0.0","0.28"
"Second serenity test","This isa failing","FAILURE","2019-06-03T23:17:49.415-07:00","0.0","0.33"
"Second serenity test","This test will get the information of all the students from the Student App","SUCCESS","2019-06-03T23:17:43.026-07:00","0.0","5.86"
